{
  "contract_version": "1",
  "registry_version": "conversations-golden-v1",
  "reviewed_by": "product-h4.4",
  "reviewed_at": "2026-08-10",
  "min_cases_per_family": 3,
  "cases": [
    {
      "id": "conversation-001",
      "family": "onboarding",
      "context": {
        "profile": {
          "budget_max": 900000,
          "zone": "palermo"
        }
      },
      "turns": [
        "Quiero empezar a buscar un depto en Palermo"
      ],
      "expectation": {
        "tool_calls": [
          {
            "tool": "get_search_profile",
            "args": {},
            "requires_confirmation": false,
            "order": 1
          },
          {
            "tool": "find_matches",
            "args": {
              "page": 1,
              "limit": 5
            },
            "requires_confirmation": false,
            "order": 2
          }
        ],
        "grounding": {
          "require_refs": true,
          "min_refs": 1,
          "declare_missing": false
        },
        "outcome": "completed"
      },
      "tags": [
        "onboarding"
      ],
      "notes": "Caso base de onboarding con radar existente: consulta y matches."
    },
    {
      "id": "conversation-002",
      "family": "onboarding",
      "context": {
        "profile": {
          "budget_max": 900000,
          "zone": "palermo"
        }
      },
      "turns": [
        "¿Cómo funciona esto? ¿Qué puedo hacer con mi radar?"
      ],
      "expectation": {
        "tool_calls": [
          {
            "tool": "get_search_profile",
            "args": {},
            "requires_confirmation": false,
            "order": 1
          }
        ],
        "grounding": {
          "require_refs": false,
          "min_refs": 0,
          "declare_missing": false
        },
        "outcome": "completed"
      },
      "tags": [
        "onboarding"
      ],
      "notes": "Pregunta de orientacion: lee el perfil y explica las capacidades."
    },
    {
      "id": "conversation-003",
      "family": "onboarding",
      "context": {
        "profile": null
      },
      "turns": [
        "No tengo ningún radar todavía, creame uno"
      ],
      "expectation": {
        "tool_calls": [],
        "grounding": {
          "require_refs": false,
          "min_refs": 0,
          "declare_missing": false
        },
        "outcome": "safe_refusal"
      },
      "tags": [
        "rejects"
      ],
      "notes": "Sin radar activo la creacion desde el chat queda fuera de alcance; dirige al onboarding estructurado."
    },
    {
      "id": "conversation-004",
      "family": "ambiguous_change",
      "context": {
        "profile": {
          "budget_max": 900000,
          "zone": "palermo"
        }
      },
      "turns": [
        "Aumentá el presupuesto"
      ],
      "expectation": {
        "tool_calls": [],
        "grounding": {
          "require_refs": false,
          "min_refs": 0,
          "declare_missing": false
        },
        "outcome": "clarification"
      },
      "tags": [
        "interrupts",
        "requires_confirmation"
      ],
      "notes": "Parametro de alto impacto sin valor: aclaracion acotada antes de cualquier propuesta."
    },
    {
      "id": "conversation-005",
      "family": "ambiguous_change",
      "context": {
        "profile": {
          "budget_max": 900000,
          "zone": "palermo"
        }
      },
      "turns": [
        "Quiero vivir en una zona linda"
      ],
      "expectation": {
        "tool_calls": [],
        "grounding": {
          "require_refs": false,
          "min_refs": 0,
          "declare_missing": false
        },
        "outcome": "clarification"
      },
      "tags": [
        "interrupts",
        "requires_confirmation"
      ],
      "notes": "Zona imprecisa: aclaracion en lugar de adivinar."
    },
    {
      "id": "conversation-006",
      "family": "ambiguous_change",
      "context": {
        "profile": {
          "budget_max": 900000,
          "zone": "palermo"
        }
      },
      "turns": [
        "Bajá el presupuesto a la mitad"
      ],
      "expectation": {
        "tool_calls": [],
        "grounding": {
          "require_refs": false,
          "min_refs": 0,
          "declare_missing": false
        },
        "outcome": "clarification"
      },
      "tags": [
        "interrupts",
        "requires_confirmation"
      ],
      "notes": "Referencia ambigua (mitad de que): aclaracion acotada."
    },
    {
      "id": "conversation-007",
      "family": "explanation",
      "context": {
        "profile": {
          "budget_max": 900000,
          "zone": "palermo"
        }
      },
      "turns": [
        "¿Por qué me recomendaste este depto?"
      ],
      "expectation": {
        "tool_calls": [
          {
            "tool": "explain_match",
            "args": {
              "listing_id": "00000000-0000-0000-0000-000000000001"
            },
            "requires_confirmation": false,
            "order": 1
          }
        ],
        "grounding": {
          "require_refs": true,
          "min_refs": 1,
          "declare_missing": false
        },
        "outcome": "completed"
      },
      "tags": [],
      "notes": "Explicacion grounded: cita evidencia persistida."
    },
    {
      "id": "conversation-008",
      "family": "explanation",
      "context": {
        "profile": {
          "budget_max": 900000,
          "zone": "palermo"
        }
      },
      "turns": [
        "¿Qué criterios hicieron que ese depto quedara arriba?"
      ],
      "expectation": {
        "tool_calls": [
          {
            "tool": "explain_match",
            "args": {
              "listing_id": "00000000-0000-0000-0000-000000000001"
            },
            "requires_confirmation": false,
            "order": 1
          }
        ],
        "grounding": {
          "require_refs": true,
          "min_refs": 1,
          "declare_missing": false
        },
        "outcome": "completed"
      },
      "tags": [],
      "notes": "Explicacion con criterios citando evidence refs."
    },
    {
      "id": "conversation-009",
      "family": "explanation",
      "context": {
        "profile": {
          "budget_max": 900000,
          "zone": "palermo"
        }
      },
      "turns": [
        "¿Por qué quedó afuera el de Villa Crespo?"
      ],
      "expectation": {
        "tool_calls": [
          {
            "tool": "explain_match",
            "args": {
              "listing_id": "00000000-0000-0000-0000-000000000001"
            },
            "requires_confirmation": false,
            "order": 1
          }
        ],
        "grounding": {
          "require_refs": true,
          "min_refs": 1,
          "declare_missing": true
        },
        "outcome": "completed"
      },
      "tags": [],
      "notes": "Explica exclusion declarando datos faltantes si la evidencia es debil."
    },
    {
      "id": "conversation-010",
      "family": "comparison",
      "context": {
        "profile": {
          "budget_max": 900000,
          "zone": "palermo"
        }
      },
      "turns": [
        "Compará estos dos deptos que guardé"
      ],
      "expectation": {
        "tool_calls": [
          {
            "tool": "compare_listings",
            "args": {
              "listing_ids": [
                "00000000-0000-0000-0000-000000000001",
                "00000000-0000-0000-0000-000000000002"
              ]
            },
            "requires_confirmation": false,
            "order": 1
          }
        ],
        "grounding": {
          "require_refs": true,
          "min_refs": 1,
          "declare_missing": false
        },
        "outcome": "completed"
      },
      "tags": [],
      "notes": "Comparacion estructurada persistida."
    },
    {
      "id": "conversation-011",
      "family": "comparison",
      "context": {
        "profile": {
          "budget_max": 900000,
          "zone": "palermo"
        }
      },
      "turns": [
        "¿Cuál conviene más entre estos tres?"
      ],
      "expectation": {
        "tool_calls": [
          {
            "tool": "compare_listings",
            "args": {
              "listing_ids": [
                "00000000-0000-0000-0000-000000000001",
                "00000000-0000-0000-0000-000000000002"
              ]
            },
            "requires_confirmation": false,
            "order": 1
          }
        ],
        "grounding": {
          "require_refs": true,
          "min_refs": 1,
          "declare_missing": false
        },
        "outcome": "completed"
      },
      "tags": [],
      "notes": "Comparacion sin inventar ganador generativo."
    },
    {
      "id": "conversation-012",
      "family": "comparison",
      "context": {
        "profile": {
          "budget_max": 900000,
          "zone": "palermo"
        }
      },
      "turns": [
        "Compará este depto con mi radar actual"
      ],
      "expectation": {
        "tool_calls": [
          {
            "tool": "compare_listings",
            "args": {
              "listing_ids": [
                "00000000-0000-0000-0000-000000000001",
                "00000000-0000-0000-0000-000000000002"
              ]
            },
            "requires_confirmation": false,
            "order": 1
          }
        ],
        "grounding": {
          "require_refs": true,
          "min_refs": 1,
          "declare_missing": false
        },
        "outcome": "completed"
      },
      "tags": [],
      "notes": "Comparacion contra el perfil vigente."
    },
    {
      "id": "conversation-013",
      "family": "feedback",
      "context": {
        "profile": {
          "budget_max": 900000,
          "zone": "palermo"
        }
      },
      "turns": [
        "Este depto no me gusta"
      ],
      "expectation": {
        "tool_calls": [
          {
            "tool": "record_feedback",
            "args": {